,OR,p,FDR
positive regulation of transcription by RNA polymerase II,34.1988416988417,4.565518646480631e-14,True
negative regulation of transcription by RNA polymerase II,20.247178329571106,1.1635305790941658e-09,True
regulation of transcription by RNA polymerase II,16.244015444015442,3.9656026190182244e-09,True
skeletal muscle cell differentiation,70.61278195488721,1.897581271662439e-05,True
"positive regulation of transcription, DNA-templated",12.413722826086957,3.263975487326444e-05,True
monocyte differentiation,125.4,0.00017502911232577603,False
positive regulation of pri-miRNA transcription by RNA polymerase II,49.439473684210526,0.0009876548155425663,False
transcription by RNA polymerase II,15.908961593172119,0.0013081137259686156,False
hormone-mediated signaling pathway,41.733333333333334,0.0013620371009267853,False
response to estrogen,31.80677966101695,0.0022830841113479937,False
rhythmic process,29.3140625,0.0026666489277589337,False
epithelial cell differentiation,28.422727272727272,0.0028280003882993725,False
"negative regulation of transcription, DNA-templated",7.715791693021295,0.0030434985698883617,False
circadian rhythm,26.045833333333334,0.0033389683034399723,False
cell differentiation,6.9165718619643535,0.004438128178199298,False
glucose homeostasis,16.41315789473684,0.008005032306118128,False
"regulation of transcription, DNA-templated",5.260521333915829,0.011088278874524229,False
negative regulation of cholesterol storage,99.55555555555556,0.011614578695443495,False
positive regulation of vascular associated smooth muscle cell apoptotic process,99.55555555555556,0.011614578695443495,False
positive regulation of isotype switching to IgG isotypes,99.55555555555556,0.011614578695443495,False
regulation of chondrocyte differentiation,99.55555555555556,0.011614578695443495,False
retinal cone cell development,89.5952380952381,0.012768928075583462,False
positive regulation of transcription from RNA polymerase II promoter in response to endoplasmic reticulum stress,89.5952380952381,0.012768928075583462,False
positive regulation of monocyte differentiation,89.5952380952381,0.012768928075583462,False
negative regulation of telomerase activity,89.5952380952381,0.012768928075583462,False
"positive regulation of phagocytosis, engulfment",81.44588744588745,0.013921990486909801,False
PERK-mediated unfolded protein response,81.44588744588745,0.013921990486909801,False
negative regulation of protein autophosphorylation,81.44588744588745,0.013921990486909801,False
negative regulation by host of viral transcription,81.44588744588745,0.013921990486909801,False
positive regulation of extrinsic apoptotic signaling pathway via death domain receptors,81.44588744588745,0.013921990486909801,False
transcription initiation from RNA polymerase II promoter,11.814556962025316,0.01480103404930201,False
eyelid development in camera-type eye,74.6547619047619,0.015073767296845642,False
negative regulation of macrophage derived foam cell differentiation,74.6547619047619,0.015073767296845642,False
negative regulation of intracellular estrogen receptor signaling pathway,74.6547619047619,0.015073767296845642,False
regulation of T cell differentiation,74.6547619047619,0.015073767296845642,False
epithelial cell proliferation,74.6547619047619,0.015073767296845642,False
lipoprotein transport,68.9084249084249,0.016224259868922338,False
response to lipid,68.9084249084249,0.016224259868922338,False
cellular response to organic substance,68.9084249084249,0.016224259868922338,False
negative regulation of collagen biosynthetic process,68.9084249084249,0.016224259868922338,False
white fat cell differentiation,68.9084249084249,0.016224259868922338,False
regulation of cell proliferation,11.105357142857143,0.016598243870830014,False
multicellular organism development,6.206919869266313,0.01668498599121001,False
response to muscle stretch,63.98299319727891,0.017373469568793647,False
fatty acid oxidation,63.98299319727891,0.017373469568793647,False
negative regulation of innate immune response,63.98299319727891,0.017373469568793647,False
cellular response to thyroid hormone stimulus,63.98299319727891,0.017373469568793647,False
long-chain fatty acid transport,59.714285714285715,0.01852139775812201,False
cellular response to prostaglandin E stimulus,59.714285714285715,0.01852139775812201,False
retinoic acid receptor signaling pathway,55.979166666666664,0.019668045799185765,False
positive regulation by host of viral transcription,55.979166666666664,0.019668045799185765,False
axon regeneration,55.979166666666664,0.019668045799185765,False
histone methylation,52.68347338935574,0.020813415049609877,False
response to vitamin A,49.75396825396825,0.02195750686892256,False
cellular response to low-density lipoprotein particle stimulus,47.1328320802005,0.023100322614938773,False
membrane depolarization,42.63945578231292,0.02538213130195376,False
regulation of DNA replication,42.63945578231292,0.02538213130195376,False
release of cytochrome c from mitochondria,42.63945578231292,0.02538213130195376,False
response to immobilization stress,42.63945578231292,0.02538213130195376,False
positive regulation of oligodendrocyte differentiation,40.6991341991342,0.026521126953129817,False
negative regulation of interleukin-2 production,40.6991341991342,0.026521126953129817,False
negative regulation of vascular endothelial cell proliferation,37.30357142857143,0.028795307622352356,False
regulation of DNA-binding transcription factor activity,33.15343915343915,0.03219707228072741,False
microglial cell activation,31.967687074829932,0.0333284641933973,False
positive regulation of DNA replication,31.967687074829932,0.0333284641933973,False
negative regulation of DNA binding,30.863711001642034,0.03445859352684432,False
positive regulation of DNA binding,30.863711001642034,0.03445859352684432,False
JAK-STAT cascade,29.833333333333332,0.035587461622306714,False
negative regulation of smooth muscle cell proliferation,28.86943164362519,0.03671506981850445,False
cellular response to virus,27.96577380952381,0.03784141945905965,False
dendrite morphogenesis,27.116883116883116,0.03896651187679679,False
cell fate specification,27.116883116883116,0.03896651187679679,False
regulation of heart contraction,27.116883116883116,0.03896651187679679,False
cellular response to reactive oxygen species,25.564625850340136,0.041212930400516434,False
T cell differentiation,25.564625850340136,0.041212930400516434,False
response to cold,25.564625850340136,0.041212930400516434,False
placenta development,24.853174603174605,0.042334259172715605,False
cell maturation,24.853174603174605,0.042334259172715605,False
positive regulation of epithelial cell migration,24.853174603174605,0.042334259172715605,False
negative regulation of vascular smooth muscle cell proliferation,24.853174603174605,0.042334259172715605,False
cellular response to cadmium ion,24.18018018018018,0.043454336062054746,False
negative regulation of blood vessel endothelial cell migration,22.937728937728938,0.04569073951925893,False
response to starvation,22.363095238095237,0.04680706874333203,False
animal organ regeneration,21.29591836734694,0.04903598881937062,False
cellular response to amino acid starvation,20.79955703211517,0.050148582324904205,False
regulation of protein phosphorylation,20.79955703211517,0.050148582324904205,False
lipid homeostasis,20.325757575757574,0.051259933236950064,False
gluconeogenesis,20.325757575757574,0.051259933236950064,False
response to peptide hormone,19.025329280648428,0.05458654362745325,False
positive regulation of vascular smooth muscle cell proliferation,18.62797619047619,0.05569293737493306,False
outflow tract morphogenesis,18.62797619047619,0.05569293737493306,False
positive regulation of fibroblast proliferation,18.62797619047619,0.05569293737493306,False
response to hydrogen peroxide,17.88095238095238,0.0579020181923427,False
response to mechanical stimulus,16.866127583108714,0.061206392435943585,False
positive regulation of fat cell differentiation,16.866127583108714,0.061206392435943585,False
cell fate commitment,16.552910052910054,0.06230538990259054,False
cellular response to heat,16.552910052910054,0.06230538990259054,False
positive regulation of neuron apoptotic process,16.552910052910054,0.06230538990259054,False
humoral immune response,15.408045977011493,0.06668911156588889,False
SMAD protein signal transduction,14.892857142857142,0.06887362974693569,False
learning,14.892857142857142,0.06887362974693569,False
heart looping,14.410906298003072,0.07105326671625026,False
fatty acid metabolic process,13.959077380952381,0.07322803285995376,False
regulation of circadian rhythm,13.959077380952381,0.07322803285995376,False
regulation of blood pressure,13.743589743589743,0.07431359261589658,False
cellular response to retinoic acid,13.534632034632034,0.07539793854289939,False
type I interferon signaling pathway,13.534632034632034,0.07539793854289939,False
response to nutrient,13.331911869225301,0.07648107194875928,False
positive regulation of endothelial cell proliferation,12.402777777777779,0.08187859622135003,False
Ras protein signal transduction,12.402777777777779,0.08187859622135003,False
defense response,12.232224396607958,0.08295448153117371,False
liver development,11.904761904761905,0.08510264289394001,False
negative regulation of ERK1 and ERK2 cascade,11.594310451453309,0.08724600045239597,False
axonogenesis,11.594310451453309,0.08724600045239597,False
epidermis development,11.29957805907173,0.08938456442811193,False
cellular response to calcium ion,11.019400352733687,0.09151834503886691,False
positive regulation of neuron differentiation,10.624149659863946,0.09471006943268694,False
positive regulation of interleukin-6 production,10.375968992248062,0.09683193616598039,False
activation of cysteine-type endopeptidase activity involved in apoptotic process,10.25615763546798,0.09789108848055092,False
"transcription, DNA-templated",10.25615763546798,0.09789108848055092,False
viral process,4.037362637362637,0.09859286429748491,False
regulation of lipid metabolic process,9.803244374672946,0.1021158535544998,False
mitochondrion organization,9.696169772256729,0.10316909009172263,False
cellular response to insulin stimulus,9.099611273080662,0.10946378644253593,False
chromatin remodeling,9.007215007215008,0.11050879372600873,False
transforming growth factor beta receptor signaling pathway,8.740896358543417,0.11363679702990266,False
response to virus,8.655570966250577,0.11467712943022142,False
positive regulation of DNA-binding transcription factor activity,7.9562074829931975,0.12398781767006398,False
regulation of cell cycle,7.4226190476190474,0.1321854533827349,False
negative regulation of angiogenesis,7.2404181184668985,0.1352406466096567,False
negative regulation of inflammatory response,7.2404181184668985,0.1352406466096567,False
negative regulation of cell growth,7.123809523809523,0.13727173521738503,False
animal organ morphogenesis,6.642146410803127,0.14635541683488323,False
skeletal system development,6.543767507002801,0.1483615777995755,False
negative regulation of neuron apoptotic process,6.355442176870748,0.15236040671730247,False
lipid metabolic process,6.310030395136778,0.15335730990669652,False
sensory perception of sound,6.221112221112221,0.15534775981965948,False
chromatin organization,5.849937343358396,0.16424963929949768,False
aging,5.3852813852813854,0.1769499583810263,False
Fc-epsilon receptor signaling pathway,5.320216709438267,0.17888742671034927,False
proteasome-mediated ubiquitin-dependent protein catabolic process,4.932539682539683,0.19137525819614631,False
blood coagulation,4.7979407979407975,0.1961298271167376,False
heart development,4.6953892668178385,0.19991425684922803,False
defense response to virus,4.39014615747289,0.21209655484224813,False
in utero embryonic development,4.39014615747289,0.21209655484224813,False
positive regulation of ERK1 and ERK2 cascade,4.121816168327796,0.22410167083323287,False
axon guidance,3.9903474903474905,0.23049343714808448,False
angiogenesis,3.734779987944545,0.24402125187958734,False
cellular response to DNA damage stimulus,3.7031281131699543,0.24580771516629948,False
response to drug,3.1199730775702506,0.2841054592145676,False
cytokine-mediated signaling pathway,3.108819584171697,0.28495390396121895,False
positive regulation of GTPase activity,2.8255494505494507,0.3083243989480415,False
positive regulation of apoptotic process,2.5063085063085064,0.3396640731079506,False
negative regulation of cell proliferation,2.0665992812219227,0.394718853883518,False
positive regulation of cell proliferation,1.703218005952381,0.4552705365284683,False
innate immune response,1.5852198803018476,0.4789632747110084,False
biological_process,1.443942635290389,0.5106041885440007,False
signal transduction,0.8235457448285437,0.7097824135880619,False
G protein-coupled receptor signaling pathway,0.7394121827835611,0.7467685282987635,False
positive regulation of intracellular protein transport,0.0,1.0,False
spindle organization,0.0,1.0,False
chloride transmembrane transport,0.0,1.0,False
regulation of mitotic spindle assembly,0.0,1.0,False
UV protection,0.0,1.0,False
inactivation of MAPK activity,0.0,1.0,False
negative regulation of cytokine-mediated signaling pathway,0.0,1.0,False
posttranscriptional regulation of gene expression,0.0,1.0,False
positive regulation of calcium ion import,0.0,1.0,False
vesicle organization,0.0,1.0,False
negative regulation of tyrosine phosphorylation of STAT protein,0.0,1.0,False
female gamete generation,0.0,1.0,False
negative regulation of MAPK cascade,0.0,1.0,False
peptide hormone processing,0.0,1.0,False
spindle assembly,0.0,1.0,False
regulation of double-strand break repair via homologous recombination,0.0,1.0,False
positive regulation of positive chemotaxis,0.0,1.0,False
negative regulation of protein tyrosine kinase activity,0.0,1.0,False
G protein-coupled serotonin receptor signaling pathway,0.0,1.0,False
response to UV,0.0,1.0,False
hippo signaling,0.0,1.0,False
natural killer cell activation,0.0,1.0,False
toll-like receptor 3 signaling pathway,0.0,1.0,False
positive regulation of macrophage differentiation,0.0,1.0,False
chromatin-mediated maintenance of transcription,0.0,1.0,False
nucleotide-binding oligomerization domain containing signaling pathway,0.0,1.0,False
activation of NF-kappaB-inducing kinase activity,0.0,1.0,False
regulation of store-operated calcium entry,0.0,1.0,False
regulation of membrane repolarization,0.0,1.0,False
cellular response to hepatocyte growth factor stimulus,0.0,1.0,False
defense response to fungus,0.0,1.0,False
killing of cells of other organism,0.0,1.0,False
protein polymerization,0.0,1.0,False
regulation of signaling receptor activity,0.0,1.0,False
basement membrane organization,0.0,1.0,False
axonal fasciculation,0.0,1.0,False
peripheral nervous system neuron development,0.0,1.0,False
hematopoietic stem cell proliferation,0.0,1.0,False
regulation of bicellular tight junction assembly,0.0,1.0,False
granulocyte differentiation,0.0,1.0,False
T cell mediated cytotoxicity,0.0,1.0,False
myeloid cell differentiation,0.0,1.0,False
regulation of megakaryocyte differentiation,0.0,1.0,False
protein monoubiquitination,0.0,1.0,False
actin filament depolymerization,0.0,1.0,False
fibroblast growth factor receptor signaling pathway,0.0,1.0,False
establishment of cell polarity,0.0,1.0,False
angiotensin maturation,0.0,1.0,False
mast cell degranulation,0.0,1.0,False
interleukin-6-mediated signaling pathway,0.0,1.0,False
negative regulation of epidermal growth factor-activated receptor activity,0.0,1.0,False
cellular response to exogenous dsRNA,0.0,1.0,False
regulation of myeloid cell differentiation,0.0,1.0,False
regulation of intracellular estrogen receptor signaling pathway,0.0,1.0,False
vesicle fusion,0.0,1.0,False
regulation of mitotic nuclear division,0.0,1.0,False
vesicle docking,0.0,1.0,False
negative regulation of cardiac muscle hypertrophy,0.0,1.0,False
positive regulation of myotube differentiation,0.0,1.0,False
regulation of protein kinase B signaling,0.0,1.0,False
regulation of regulatory T cell differentiation,0.0,1.0,False
heart trabecula formation,0.0,1.0,False
positive regulation of ubiquitin-dependent protein catabolic process,0.0,1.0,False
negative regulation of smoothened signaling pathway,0.0,1.0,False
thyroid hormone generation,0.0,1.0,False
sperm capacitation,0.0,1.0,False
vesicle docking involved in exocytosis,0.0,1.0,False
positive regulation of microglial cell activation,0.0,1.0,False
negative regulation of cell growth involved in cardiac muscle cell development,0.0,1.0,False
positive regulation of tumor necrosis factor-mediated signaling pathway,0.0,1.0,False
acetylcholine receptor signaling pathway,0.0,1.0,False
NLS-bearing protein import into nucleus,0.0,1.0,False
anterograde synaptic vesicle transport,0.0,1.0,False
regulation of ryanodine-sensitive calcium-release channel activity,0.0,1.0,False
negative regulation of ryanodine-sensitive calcium-release channel activity,0.0,1.0,False
single strand break repair,0.0,1.0,False
G2/M transition of mitotic cell cycle,0.0,1.0,False
phosphatidylinositol phosphorylation,0.0,1.0,False
chaperone-mediated protein folding,0.0,1.0,False
interleukin-7-mediated signaling pathway,0.0,1.0,False
cellular response to cold,0.0,1.0,False
protein export from nucleus,0.0,1.0,False
protein folding in endoplasmic reticulum,0.0,1.0,False
cellular senescence,0.0,1.0,False
negative regulation of cytokine secretion,0.0,1.0,False
interleukin-1-mediated signaling pathway,0.0,1.0,False
"positive regulation of mRNA splicing, via spliceosome",0.0,1.0,False
myeloid dendritic cell differentiation,0.0,1.0,False
inositol phosphate metabolic process,0.0,1.0,False
regulation of rhodopsin mediated signaling pathway,0.0,1.0,False
positive regulation of excitatory postsynaptic potential,0.0,1.0,False
UTP biosynthetic process,0.0,1.0,False
cellular response to drug,0.0,1.0,False
short-term memory,0.0,1.0,False
retina layer formation,0.0,1.0,False
glycerophospholipid biosynthetic process,0.0,1.0,False
positive regulation of protein autophosphorylation,0.0,1.0,False
"regulation of synaptic transmission, GABAergic",0.0,1.0,False
negative regulation of bone resorption,0.0,1.0,False
detection of calcium ion,0.0,1.0,False
"Wnt signaling pathway, calcium modulating pathway",0.0,1.0,False
negative regulation of peptidyl-threonine phosphorylation,0.0,1.0,False
regulation of release of sequestered calcium ion into cytosol by sarcoplasmic reticulum,0.0,1.0,False
negative regulation of gluconeogenesis,0.0,1.0,False
regulation of fibroblast migration,0.0,1.0,False
regulation of neurotransmitter secretion,0.0,1.0,False
positive regulation of interferon-alpha production,0.0,1.0,False
regulation of neuron migration,0.0,1.0,False
regulation of interleukin-6 production,0.0,1.0,False
neuron cellular homeostasis,0.0,1.0,False
neuromuscular process,0.0,1.0,False
cellular response to interferon-beta,0.0,1.0,False
regulation of cytoskeleton organization,0.0,1.0,False
proteolysis involved in cellular protein catabolic process,0.0,1.0,False
blastocyst development,0.0,1.0,False
nervous system process,0.0,1.0,False
myofibril assembly,0.0,1.0,False
negative regulation of protein sumoylation,0.0,1.0,False
muscle structure development,0.0,1.0,False
microtubule bundle formation,0.0,1.0,False
transmission of nerve impulse,0.0,1.0,False
regulation of lamellipodium assembly,0.0,1.0,False
cation transport,0.0,1.0,False
cornification,0.0,1.0,False
receptor catabolic process,0.0,1.0,False
actin polymerization or depolymerization,0.0,1.0,False
positive regulation of dendritic spine morphogenesis,0.0,1.0,False
receptor recycling,0.0,1.0,False
I-kappaB phosphorylation,0.0,1.0,False
stimulatory C-type lectin receptor signaling pathway,0.0,1.0,False
negative regulation of proteasomal ubiquitin-dependent protein catabolic process,0.0,1.0,False
killing by host of symbiont cells,0.0,1.0,False
regulation of synapse assembly,0.0,1.0,False
response to cocaine,0.0,1.0,False
regulation of dopamine metabolic process,0.0,1.0,False
muscle fiber development,0.0,1.0,False
regulation of neuron death,0.0,1.0,False
interleukin-27-mediated signaling pathway,0.0,1.0,False
regulation of dopamine secretion,0.0,1.0,False
action potential,0.0,1.0,False
interleukin-35-mediated signaling pathway,0.0,1.0,False
regulation of cell morphogenesis,0.0,1.0,False
negative regulation of excitatory postsynaptic potential,0.0,1.0,False
regulation of postsynaptic density assembly,0.0,1.0,False
response to unfolded protein,0.0,1.0,False
protein targeting to lysosome,0.0,1.0,False
nucleocytoplasmic transport,0.0,1.0,False
lens development in camera-type eye,0.0,1.0,False
regulation of gene silencing,0.0,1.0,False
centriole replication,0.0,1.0,False
nucleobase-containing small molecule catabolic process,0.0,1.0,False
synaptic vesicle exocytosis,0.0,1.0,False
positive regulation of tyrosine phosphorylation of STAT protein,0.0,1.0,False
activation of JUN kinase activity,0.0,1.0,False
isotype switching,0.0,1.0,False
hyaluronan catabolic process,0.0,1.0,False
positive regulation of cell-cell adhesion,0.0,1.0,False
positive regulation of T cell activation,0.0,1.0,False
inflammatory response to antigenic stimulus,0.0,1.0,False
cellular response to interleukin-1,0.0,1.0,False
cellular response to nutrient levels,0.0,1.0,False
regulation of phagocytosis,0.0,1.0,False
layer formation in cerebral cortex,0.0,1.0,False
positive regulation of interleukin-10 production,0.0,1.0,False
negative regulation of voltage-gated calcium channel activity,0.0,1.0,False
positive regulation of signal transduction,0.0,1.0,False
regulation of T cell proliferation,0.0,1.0,False
glomerular filtration,0.0,1.0,False
astrocyte development,0.0,1.0,False
phospholipid transport,0.0,1.0,False
intestinal cholesterol absorption,0.0,1.0,False
synaptic vesicle transport,0.0,1.0,False
receptor clustering,0.0,1.0,False
sensory perception of taste,0.0,1.0,False
corpus callosum development,0.0,1.0,False
androgen biosynthetic process,0.0,1.0,False
positive regulation of triglyceride biosynthetic process,0.0,1.0,False
regulation of neurotransmitter receptor activity,0.0,1.0,False
prostaglandin biosynthetic process,0.0,1.0,False
regulation of macrophage activation,0.0,1.0,False
keratinocyte proliferation,0.0,1.0,False
keratinization,0.0,1.0,False
regulation of axonogenesis,0.0,1.0,False
regulation of mitotic metaphase/anaphase transition,0.0,1.0,False
mitotic DNA replication checkpoint,0.0,1.0,False
mitotic sister chromatid cohesion,0.0,1.0,False
blood vessel morphogenesis,0.0,1.0,False
DNA replication checkpoint,0.0,1.0,False
positive regulation of ubiquitin protein ligase activity,0.0,1.0,False
protein K11-linked ubiquitination,0.0,1.0,False
nuclear migration,0.0,1.0,False
negative regulation of protein complex assembly,0.0,1.0,False
filopodium assembly,0.0,1.0,False
glial cell differentiation,0.0,1.0,False
positive regulation of filopodium assembly,0.0,1.0,False
positive regulation of mitotic metaphase/anaphase transition,0.0,1.0,False
cytoskeleton-dependent cytokinesis,0.0,1.0,False
"mRNA splicing, via spliceosome",0.0,1.0,False
positive regulation of axon extension,0.0,1.0,False
lamellipodium assembly,0.0,1.0,False
positive regulation of B cell receptor signaling pathway,0.0,1.0,False
protein localization to lysosome,0.0,1.0,False
positive regulation of protein exit from endoplasmic reticulum,0.0,1.0,False
synaptic membrane adhesion,0.0,1.0,False
pyrimidine nucleoside salvage,0.0,1.0,False
regulation of G2/M transition of mitotic cell cycle,0.0,1.0,False
chromosome condensation,0.0,1.0,False
protein localization to kinetochore,0.0,1.0,False
positive regulation of protein import into nucleus,0.0,1.0,False
regulation of embryonic development,0.0,1.0,False
regulation of synapse organization,0.0,1.0,False
negative regulation of microtubule polymerization,0.0,1.0,False
ciliary basal body-plasma membrane docking,0.0,1.0,False
regulation of mRNA processing,0.0,1.0,False
protein tetramerization,0.0,1.0,False
positive regulation of phosphatidylinositol 3-kinase activity,0.0,1.0,False
immunoglobulin mediated immune response,0.0,1.0,False
dentate gyrus development,0.0,1.0,False
establishment of mitotic spindle orientation,0.0,1.0,False
T cell proliferation,0.0,1.0,False
regulation of insulin receptor signaling pathway,0.0,1.0,False
DNA replication initiation,0.0,1.0,False
presynaptic membrane assembly,0.0,1.0,False
postsynaptic membrane assembly,0.0,1.0,False
CENP-A containing nucleosome assembly,0.0,1.0,False
fatty acid catabolic process,0.0,1.0,False
synapsis,0.0,1.0,False
SCF-dependent proteasomal ubiquitin-dependent protein catabolic process,0.0,1.0,False
positive regulation of macrophage activation,0.0,1.0,False
transcription-coupled nucleotide-excision repair,0.0,1.0,False
embryo development,0.0,1.0,False
transcription initiation from RNA polymerase I promoter,0.0,1.0,False
natural killer cell mediated cytotoxicity,0.0,1.0,False
cellular response to fatty acid,0.0,1.0,False
ventricular cardiac muscle cell development,0.0,1.0,False
mitotic metaphase plate congression,0.0,1.0,False
DNA biosynthetic process,0.0,1.0,False
metaphase plate congression,0.0,1.0,False
attachment of mitotic spindle microtubules to kinetochore,0.0,1.0,False
protein maturation,0.0,1.0,False
cyclooxygenase pathway,0.0,1.0,False
kinetochore assembly,0.0,1.0,False
L-phenylalanine catabolic process,0.0,1.0,False
negative regulation of appetite,0.0,1.0,False
regulation of phosphatidylinositol 3-kinase activity,0.0,1.0,False
digestive tract development,0.0,1.0,False
regulation of establishment of cell polarity,0.0,1.0,False
response to glucagon,0.0,1.0,False
cellular response to leptin stimulus,0.0,1.0,False
mitotic spindle organization,0.0,1.0,False
mitotic nuclear envelope disassembly,0.0,1.0,False
transcription elongation from RNA polymerase I promoter,0.0,1.0,False
dendritic spine morphogenesis,0.0,1.0,False
